{
  "competition_slug": "elo-merchant-category-recommendation",
  "testcase_id": "tc1_from_scratch",
  "agent_name": "human",
  "run_by": "Sean Kraemer",
  "run_id": "human_tc1_sean_kraemer_v4_manual_rebuild",
  "artifact_refs": [
    {
      "kind": "notebook",
      "path": "work.ipynb",
      "description": "Evidence-only notebook used to inspect the Elo data and freeze a plain-language shortlist before bank alignment."
    },
    {
      "kind": "notes",
      "path": "manual_selection_worksheet.md",
      "description": "Authoritative shortlist-to-bank mapping for the Elo human baseline."
    },
    {
      "kind": "notes",
      "path": "notes.md",
      "description": "Author notes for the Elo human baseline."
    },
    {
      "kind": "metadata",
      "path": "provenance/metadata.json",
      "description": "Run-level metadata for the Elo human baseline."
    },
    {
      "kind": "trace",
      "path": "provenance/action_trace.json",
      "description": "Links each selected bank action to notebook evidence or worksheet sections."
    }
  ],
  "predicted_add_action_ids": [
    "CA-000004",
    "CA-000047",
    "CA-000035",
    "CA-000011",
    "CA-000062",
    "CA-000051",
    "CA-000060",
    "CA-000049"
  ],
  "predicted_remove_action_ids": [],
  "time_spent_seconds": 3300,
  "token_usage": {
    "input_tokens": null,
    "output_tokens": null,
    "total_tokens": null
  },
  "notes": "Manual Elo TC1 baseline. The final selection keeps the card-age block, simple base-card encodings, `month_diff`, and the numeric aggregation path on both transaction tables while stopping before the transaction-flag cleanup branch."
}
