{
  "competition_slug": "recruit-restaurant-visitor-forecasting",
  "testcase_id": "tc1_from_scratch",
  "agent_name": "human",
  "run_by": "annotator_a",
  "run_id": "human_tc1_annotator_a_v1",
  "artifact_refs": [
    {
      "kind": "notebook",
      "path": "work.ipynb",
      "description": "In-progress manual notebook scaffold for the Recruit TC1 human baseline."
    },
    {
      "kind": "metadata",
      "path": "provenance/metadata.json",
      "description": "Run-level metadata for the in-progress human baseline."
    },
    {
      "kind": "trace",
      "path": "provenance/action_trace.json",
      "description": "Maps the current selected bank actions to scaffold sections."
    },
    {
      "kind": "notes",
      "path": "notes.md",
      "description": "Author notes for the current Recruit human baseline selection."
    }
  ],
  "predicted_add_action_ids": [
    "CA-000023",
    "CA-000087",
    "CA-000015",
    "CA-000027",
    "CA-000041",
    "CA-000018",
    "CA-000032",
    "CA-000036",
    "CA-000046",
    "CA-000049",
    "CA-000050",
    "CA-000043",
    "CA-000086",
    "CA-000009",
    "CA-000080",
    "CA-000055",
    "CA-000039",
    "CA-000059",
    "CA-000064",
    "CA-000090",
    "CA-000026",
    "CA-000028",
    "CA-000029"
  ],
  "predicted_remove_action_ids": [],
  "time_spent_seconds": 1800,
  "token_usage": {
    "input_tokens": null,
    "output_tokens": null,
    "total_tokens": null
  },
  "notes": "In-progress manual Recruit TC1 selection file. Linked scaffold and provenance notes are synchronized to this current selection, but this is still not a finalized notebook-first human baseline."
}
