{
  "competition_slug": "ashrae-energy-prediction",
  "testcase_id": "tc1_from_scratch",
  "agent_name": "human",
  "run_by": "annotator_c",
  "run_id": "human_tc1_annotator_c_v1",
  "artifact_refs": [
    {
      "kind": "notebook",
      "path": "work.ipynb",
      "description": "Manual official-only notebook used to author the ASHRAE TC1 human baseline."
    },
    {
      "kind": "metadata",
      "path": "provenance/metadata.json",
      "description": "Run-level metadata for the canonical ASHRAE human baseline."
    },
    {
      "kind": "trace",
      "path": "provenance/action_trace.json",
      "description": "Maps each predicted bank action to the supporting notebook section."
    },
    {
      "kind": "notes",
      "path": "notes.md",
      "description": "Author notes for the ASHRAE human baseline."
    }
  ],
  "predicted_add_action_ids": [
    "CA-000002",
    "CA-000010",
    "CA-000006",
    "CA-000014",
    "CA-000012",
    "CA-000020",
    "CA-000016",
    "CA-000022",
    "CA-000004",
    "CA-000018",
    "CA-000008"
  ],
  "predicted_remove_action_ids": [],
  "time_spent_seconds": 2700,
  "token_usage": {
    "input_tokens": null,
    "output_tokens": null,
    "total_tokens": null
  },
  "notes": "True bank-id authoring for tc1_from_scratch using an official-only repo-local notebook. The baseline selects the conservative primary spine plus the explicitly implemented model-specific branches for meter one-hot encoding, square_feet log transform, target log transform, and final column cleanup."
}
