{
  "competition_slug": "porto-seguro-safe-driver-prediction",
  "testcase_id": "tc1_from_scratch",
  "agent_name": "human",
  "run_by": "Sean Kraemer",
  "run_id": "human_tc1_sean_kraemer_v3_manual_rebuild",
  "artifact_refs": [
    {
      "kind": "notebook",
      "path": "work.ipynb",
      "description": "Evidence-only notebook used to inspect the Porto data and freeze a plain-language shortlist before bank alignment."
    },
    {
      "kind": "notes",
      "path": "manual_selection_worksheet.md",
      "description": "Authoritative shortlist-to-bank mapping for the Porto human baseline."
    },
    {
      "kind": "notes",
      "path": "notes.md",
      "description": "Author notes for the Porto human baseline."
    },
    {
      "kind": "metadata",
      "path": "provenance/metadata.json",
      "description": "Run-level metadata for the Porto human baseline."
    },
    {
      "kind": "trace",
      "path": "provenance/action_trace.json",
      "description": "Links each selected bank action to notebook evidence or worksheet sections."
    }
  ],
  "predicted_add_action_ids": [
    "CA-000019",
    "CA-000029",
    "CA-000008",
    "CA-000040"
  ],
  "predicted_remove_action_ids": [],
  "time_spent_seconds": 2700,
  "token_usage": {
    "input_tokens": null,
    "output_tokens": null,
    "total_tokens": null
  },
  "notes": "Manual Porto TC1 baseline. The final selection stops at sentinel cleanup, sparse-column pruning, calc drop, and id drop, while leaving the typed imputation branch out of the baseline."
}
