{
  "competition_slug": "zillow-prize-1",
  "testcase_id": "tc1_from_scratch",
  "agent_name": "human",
  "run_by": "annotator_a",
  "run_id": "human_tc1_annotator_a_v1",
  "artifact_refs": [
    {
      "kind": "notebook",
      "path": "work.ipynb",
      "description": "Original manual notebook used to build the Zillow TC1 human baseline."
    },
    {
      "kind": "metadata",
      "path": "provenance/metadata.json",
      "description": "Run-level metadata for the canonical human baseline."
    },
    {
      "kind": "trace",
      "path": "provenance/action_trace.json",
      "description": "Links each selected bank action to notebook evidence and mapping rationale."
    },
    {
      "kind": "notes",
      "path": "notes.md",
      "description": "Author notes for the canonical human baseline."
    }
  ],
  "predicted_add_action_ids": [
    "CA-000107",
    "CA-000045",
    "CA-000010",
    "CA-000007",
    "CA-000031",
    "CA-000050",
    "CA-000068",
    "CA-000073",
    "CA-000036",
    "CA-000033",
    "CA-000069",
    "CA-000060",
    "CA-000059",
    "CA-000055",
    "CA-000099",
    "CA-000038"
  ],
  "predicted_remove_action_ids": [],
  "time_spent_seconds": 1800,
  "token_usage": {
    "input_tokens": null,
    "output_tokens": null,
    "total_tokens": null
  },
  "notes": "Human-authored TC1 selection updated from the current bank review. Selected join/date handling, a broad missing-value and value-stabilization bundle, conservative row filtering / deduplication, a small categorical encoding block, and a couple of basic transform actions for the from-scratch baseline."
}
