{
  "competition_slug": "allstate-claims-severity",
  "testcase_id": "tc1_from_scratch",
  "agent_name": "human",
  "run_by": "Sean Kraemer",
  "run_id": "human_tc1_sean_kraemer_v2_simple_baseline",
  "artifact_refs": [
    {
      "kind": "notebook",
      "path": "work.ipynb",
      "description": "Manual notebook that records the selected Allstate preprocessing path for TC1."
    },
    {
      "kind": "metadata",
      "path": "provenance/metadata.json",
      "description": "Run-level metadata for the human baseline."
    },
    {
      "kind": "trace",
      "path": "provenance/action_trace.json",
      "description": "Per-action mapping from CA-IDs to notebook evidence and selection rationale."
    },
    {
      "kind": "notes",
      "path": "notes.md",
      "description": "Author notes for the migrated and refreshed human baseline."
    }
  ],
  "predicted_add_action_ids": [
    "CA-000001",
    "CA-000005"
  ],
  "predicted_remove_action_ids": [],
  "time_spent_seconds": 1800,
  "token_usage": {
    "input_tokens": null,
    "output_tokens": null,
    "total_tokens": null
  },
  "notes": "I treated this as a quick first-pass Allstate baseline rather than an answer-key reconstruction. I kept the two steps I would almost certainly do immediately: drop the identifier and label-encode cat1-cat116 with train+test levels. I did not include the target log transform in this baseline, even though it is in the curated bank, because I wanted the artifact to reflect an imperfect human pass rather than a perfect migration from the candidate bank."
}
